{
  "actor": {
    "environment": "prod",
    "service": {
      "instance": "pod-17",
      "name": "rt-ai-recommender",
      "version": "0.1.0"
    },
    "signer_id": "svc:rt-ai-recommender:prod"
  },
  "artifacts": {
    "input": {
      "algo": "sha256",
      "digest": "cccccccccccccccccccccccccccccccccccccccccccccccccccccccccccccccc",
      "uri": "ehr://bundle/opaque-input-id"
    },
    "output": {
      "algo": "sha256",
      "digest": "dddddddddddddddddddddddddddddddddddddddddddddddddddddddddddddddd",
      "uri": "ehr://note/opaque-output-id"
    },
    "transcript": {
      "algo": "sha256",
      "digest": "eeeeeeeeeeeeeeeeeeeeeeeeeeeeeeeeeeeeeeeeeeeeeeeeeeeeeeeeeeeeeeee",
      "uri": "store://audit/transcript/opaque"
    }
  },
  "created_at": "2026-02-09T03:31:00Z",
  "event": {
    "action": "recommendation",
    "reason_codes": [
      "MODEL_USED",
      "POLICY_HASHED",
      "PSEUDONYMIZED_SUBJECT"
    ],
    "risk_tier": "high",
    "type": "ai_decision",
    "workflow": "rt_pathway_v2"
  },
  "model": {
    "build": "git:f00dbabe",
    "name": "rt-recommender",
    "policy_hash": {
      "algo": "sha256",
      "digest": "ffffffffffffffffffffffffffffffffffffffffffffffffffffffffffffffff"
    },
    "vendor": "internal",
    "version": "2026.02"
  },
  "receipt_id": "rx:ai:2026-02-09T03:31:00Z:0001",
  "schema": "healthcare_ai_v1",
  "subject": {
    "context_min": {
      "age_band": "50-64",
      "sex": "male",
      "unit": "ICU"
    },
    "encounter_ref": {
      "algo": "sha256",
      "digest": "bbbbbbbbbbbbbbbbbbbbbbbbbbbbbbbbbbbbbbbbbbbbbbbbbbbbbbbbbbbbbbbb"
    },
    "patient_ref": {
      "algo": "sha256",
      "digest": "aaaaaaaaaaaaaaaaaaaaaaaaaaaaaaaaaaaaaaaaaaaaaaaaaaaaaaaaaaaaaaaa"
    }
  }
}